{
  "id": "MED-RC-005-IDENTITY-001",
  "cultivarId": "RC-005",
  "mediaType": "atlas-illustration",
  "role": "identity-plate",
  "subject": "whole-plant-habit",
  "season": "representative",
  "status": "pilot-approved",
  "assetPath": "/media/identity-plates/aureum.svg",
  "thumbnailPath": "/media/identity-plates/aureum.svg",
  "altText": "Standardized Atlas editorial illustration of Acer shirasawanum 'Aureum' showing a rounded silhouette and representative foliage palette.",
  "caption": "Aureum standardized Atlas identity plate.",
  "credit": "Japanese Maple Atlas",
  "creatorType": "procedural-editorial-illustration",
  "rights": "Copyright retained; licensing decision pending",
  "evidentiaryStatus": "illustrative-not-evidence",
  "styleVersion": "atlas-identity-plate-v1",
  "reviewNotes": "Pilot visual for interface and comparison testing. Must be reviewed against canonical cultivar descriptions before final publication."
}
