{
  "id": "MED-RC-003-IDENTITY-001",
  "cultivarId": "RC-003",
  "mediaType": "atlas-illustration",
  "role": "identity-plate",
  "subject": "whole-plant-habit",
  "season": "representative",
  "status": "pilot-approved",
  "assetPath": "/media/identity-plates/sango-kaku.svg",
  "thumbnailPath": "/media/identity-plates/sango-kaku.svg",
  "altText": "Standardized Atlas editorial illustration of Acer palmatum 'Sango-kaku' showing a upright silhouette and representative foliage palette.",
  "caption": "Sango-kaku standardized Atlas identity plate.",
  "credit": "Japanese Maple Atlas",
  "creatorType": "procedural-editorial-illustration",
  "rights": "Copyright retained; licensing decision pending",
  "evidentiaryStatus": "illustrative-not-evidence",
  "styleVersion": "atlas-identity-plate-v1",
  "reviewNotes": "Pilot visual for interface and comparison testing. Must be reviewed against canonical cultivar descriptions before final publication."
}
